8. Capture IP address Packets

root@ljingGBC-lamp-ubuntu:~# tcpdump -n -i eth0

tcpdump: verbose output suppressed, use -v or -vv for full protocol decode
listening on eth0, link-type EN10MB (Ethernet), capture size 262144 bytes
05:36:19.026265 IP 178.128.224.10.22 > 104.152.163.93.63383: Flags [P.], seq 783763896:783764004, ack 1240278831, win 501, length 108
05:36:19.026363 IP 178.128.224.10.22 > 104.152.163.93.63383: Flags [P.], seq 108:144, ack 1, win 501, length 36
05:36:19.026450 IP 178.128.224.10.22 > 104.152.163.93.63383: Flags [P.], seq 144:252, ack 1, win 501, length 108
05:36:19.026540 IP 178.128.224.10.22 > 104.152.163.93.63383: Flags [P.], seq 252:288, ack 1, win 501, length 36
05:36:19.026676 IP 178.128.224.10.22 > 104.152.163.93.63383: Flags [P.], seq 288:460, ack 1, win 501, length 172
05:36:19.026743 IP 178.128.224.10.22 > 104.152.163.93.63383: Flags [P.], seq 460:644, ack 1, win 501, length 184
05:36:19.026792 IP 178.128.224.10.22 > 104.152.163.93.63383: Flags [P.], seq 644:680, ack 1, win 501, length 36
05:36:19.040237 IP 104.152.163.93.63383 > 178.128.224.10.22: Flags [.], ack 108, win 2063, length 0
05:36:19.040293 IP 178.128.224.10.22 > 104.152.163.93.63383: Flags [P.], seq 680:1600, ack 1, win 501, length 920
05:36:19.040311 IP 104.152.163.93.63383 > 178.128.224.10.22: Flags [.], ack 460, win 2062, length 0
05:36:19.040318 IP 104.152.163.93.63383 > 178.128.224.10.22: Flags [.], ack 680, win 2061, length 0
05:36:19.040480 IP 178.128.224.10.22 > 104.152.163.93.63383: Flags [P.], seq 1600:1740, ack 1, win 501, length 140
05:36:19.040563 IP 178.128.224.10.22 > 104.152.163.93.63383: Flags [P.], seq 1740:1776, ack 1, win 501, length 36
05:36:19.040625 IP 178.128.224.10.22 > 104.152.163.93.63383: Flags [P.], seq 1776:1924, ack 1, win 501, length 148
05:36:19.040693 IP 178.128.224.10.22 > 104.152.163.93.63383: Flags [P.], seq 1924:2100, ack 1, win 501, length 176
